{
  "session_id": "full-flow-board-log-rework-closure",
  "producer_agent": "repo-implementer",
  "files_changed": ["src/example/fusion/timestamp_alignment.cpp", "src/example/fusion/ego_motion_compensation.cpp"],
  "verification_results": [
    {
      "command": "example-local-ego-motion-compensation-regression",
      "status": "passed"
    }
  ]
}
